{
  "schema": "sap-agent-context.consumer-contract-json-examples.v1",
  "artifact_kind": "consumer_contract_json_examples",
  "id": "consumer-contract-json-examples",
  "purpose": "Machine-readable examples for downstream agents consuming SAP Agent Context bundles, query explanations, consultant answers, citations, evidence, boundaries and gaps without inventing tenant or release proof.",
  "source_refs": [
    "docs/repo-go-vision.json#first_build_slices.consumer-contract-json-examples",
    "docs/context-bundle-consumer-contract.md",
    "examples/downstream-consumer-fixtures.json",
    "examples/answer-proof-examples.json",
    "schema/answer-profiles.json"
  ],
  "coverage": [
    "ready context bundle",
    "needs_curation context bundle",
    "report_only maturity boundary",
    "query-explain ranking/source explanation",
    "consultant-answer citations/evidence/boundary",
    "answer-profile ready/fail-closed profile rules",
    "anti-hallucination tenant fact"
  ],
  "examples": [
    {
      "id": "ready_bundle_consumer",
      "title": "Ready context bundle consumer pattern",
      "source_surface": "context_bundle",
      "command": "uv run sap-agent-context query --intent fo.workflow --topic supplier-invoice workflow --sap-product s4hana_cloud_public --limit 12 --output build/context-bundles/supplier-invoice-workflow.json",
      "input_focus": "A bundle with status=ready, citations, selected items, gaps=[] and quality_signals.gap_count=0.",
      "required_output_fields": [
        "status",
        "items",
        "citations",
        "gaps",
        "quality_signals",
        "consumer_contract"
      ],
      "safe_consumer_behavior": [
        "Use the bundle as starter context only.",
        "Preserve item ids, citation ids, access labels and freshness metadata in downstream source maps.",
        "Ask tenant-specific follow-up questions for approval thresholds, role names, system behavior or customer mappings."
      ],
      "must_not_claim": [
        "Do not claim tenant configuration truth from a ready bundle.",
        "Do not invent approver roles, thresholds, URLs or customer-specific process variants."
      ]
    },
    {
      "id": "needs_curation_bundle_consumer",
      "title": "Needs-curation context bundle consumer pattern",
      "source_surface": "context_bundle",
      "command": "uv run sap-agent-context query --intent fo.reporting --topic generic executive dashboard performance report --limit 12",
      "input_focus": "A bundle with status=needs_curation and gaps explaining why final output is blocked.",
      "required_output_fields": [
        "status",
        "gaps",
        "quality_signals",
        "query"
      ],
      "safe_consumer_behavior": [
        "Treat the response as draft-only.",
        "Surface the gaps before any final prose or customer-facing document.",
        "Turn gaps into concrete evidence requests such as KPI names, source query/table/app and freshness expectations."
      ],
      "must_not_claim": [
        "Do not produce final dashboard requirements from a needs_curation bundle.",
        "Do not infer KPIs, filters, roles or data sources from generic SAP wording."
      ]
    },
    {
      "id": "query_explain_consumer",
      "title": "Query-explain consumer pattern",
      "source_surface": "query_explain",
      "command": "uv run sap-agent-context query-explain \"Welke communicatie arrangement security checks en redactie zijn nodig zonder secrets of tenant URL?\" --limit 5",
      "input_focus": "A query-explain payload with rank_source, matched_terms, claim_ids, source_ids, access and freshness for each ranked result.",
      "required_output_fields": [
        "command",
        "status",
        "query",
        "results",
        "top_explanation",
        "explain_contract"
      ],
      "safe_consumer_behavior": [
        "Explain why the top result matched using rank_source, matched_terms, claim_ids and source_ids.",
        "Keep retrieval evidence separate from tenant-specific proof.",
        "If access is internal_derived or gated, carry the boundary into the downstream response."
      ],
      "must_not_claim": [
        "Do not present rank score as SAP correctness.",
        "Do not hide access/freshness/source boundaries behind fluent prose."
      ]
    },
    {
      "id": "consultant_answer_consumer",
      "title": "Consultant-answer consumer pattern",
      "source_surface": "consultant_answer",
      "command": "uv run sap-agent-context consultant-answer \"Welke communicatie arrangement security checks en redactie zijn nodig zonder secrets of tenant URL?\" --limit 12",
      "input_focus": "A deterministic consultant-answer payload with status=ready, classification=integration_security, citations, evidence and boundary booleans.",
      "required_output_fields": [
        "artifact_kind",
        "status",
        "classification",
        "answer",
        "citations",
        "evidence",
        "decision_trace",
        "boundary",
        "contract"
      ],
      "safe_consumer_behavior": [
        "Use the decision_trace to explain why the answer is ready or needs_curation.",
        "Preserve citations and evidence ids when reusing the answer.",
        "Show boundary.live_web_validation=false, boundary.expert_certification=false and boundary.tenant_specific_truth=false when implementation decisions matter.",
        "Use the answer as local extracted context, not as target tenant verification."
      ],
      "must_not_claim": [
        "Do not claim live SAP Help verification from consultant-answer output.",
        "Do not convert ready into tenant-specific configuration proof.",
        "Do not drop decision_trace when converting consultant-answer output into downstream prose."
      ]
    },
    {
      "id": "answer_profile_consumer",
      "title": "Answer-profile consumer pattern",
      "source_surface": "answer_profile",
      "command": "python3 -m json.tool schema/answer-profiles.json >/dev/null",
      "input_focus": "Profile records that name classification status, support_ids, required_answer_citation_ids, positive_fixture_ids and adversarial_probe_ids.",
      "required_output_fields": [
        "schema",
        "artifact_kind",
        "profiles",
        "classification",
        "status",
        "support_ids",
        "boundary_notes"
      ],
      "safe_consumer_behavior": [
        "Treat profiles as runtime safety contracts rather than SAP content coverage.",
        "Require support ids, positive fixtures and adversarial probes before promoting a ready profile.",
        "Keep generic, unsupported, tenant, release and customizing prompts needs_curation unless a profile explicitly supports them."
      ],
      "must_not_claim": [
        "Do not use profile count as proof of SAP domain maturity.",
        "Do not add a ready profile without positive and adversarial coverage."
      ]
    }
  ],
  "anti_examples": [
    {
      "id": "hallucinated_tenant_configuration",
      "unsafe_pattern": "The downstream agent turns a ready bundle or consultant answer into a concrete customer threshold, Z-role, tenant URL or customizing value.",
      "blocked_by": [
        "boundary.tenant_specific_truth=false",
        "gaps",
        "access labels",
        "answer profile boundary_notes"
      ],
      "safe_replacement": "State that local context is ready for starter analysis, then ask for target tenant/release/customizing evidence before implementation-ready claims."
    },
    {
      "id": "hidden_needs_curation_gap",
      "unsafe_pattern": "The downstream agent omits gaps and writes final prose from status=needs_curation.",
      "blocked_by": [
        "status",
        "gaps",
        "quality_signals.gap_count",
        "consumer_contract.statuses"
      ],
      "safe_replacement": "Label the output draft-only, show the gaps first and convert each gap into a curation request."
    }
  ],
  "consumer_rules": [
    "Ready is starter context, not tenant truth.",
    "needs_curation is draft-only and must surface gaps before final output.",
    "report_only is a maturity/planning signal, not final bundle readiness.",
    "Citations, source ids, access labels and freshness metadata must survive downstream transformations.",
    "Query-explain ranks evidence; it does not certify SAP correctness.",
    "Consultant-answer is deterministic local extraction; it performs no live web validation, expert certification or tenant-specific verification."
  ]
}
